treatment_name,liquid_available,odt_available,first_author,doi,commercial_affiliation,publication_date,journal,study_type,duration,sample_size,gender_ratio,age_range,dose_range,primary_outcome_area,primary_outcome_measures,primary_results,secondary_outcome_area,secondary_outcome_measures,secondary_results,side_effects,safety_rating,dropout_rate,race_ethnicity,notes,sequence_generation_bias,allocation_concealment_bias,outcome_assessor_blinding_bias,clinician_blinding_bias,attrition_bias,reporting_bias,bias_notes
Naltrexone,No,No,"Campbell, Magda",,No conflicts of interest reported. ,1993,Journal of the American Academy of Child and Adolescent Psychiatry,Randomized Double-blind Placebo Controlled ,6 weeks,41,,2.9-7.8 y,,Aggression and self injurous behaviors (SIB).,Aggression and self injurous bx (SIB).,No improvements in SIB or core features of ASD.,Hyperactivity,CPRS,Significant improvement in hyperactivity.,Well tolerated.,,,,"""Naltrexone does not appear to have robust effects targeting ASD-Associated aggression, although it may have some impact on hyperactivity in the population"" (Fitzpatrick)",,,,,,,
Naltrexone,No,No,"Campbell, Magda",,,,Journal of the American Academy of Child and Adolescent Psychiatry ,Randomized Double-blind Placebo Controlled ,6 weeks,41,21 M: 3 F,2.9-7.8 y,1.0 mg/kg/d,Attention and hyperactivity.,Attention and discrimination learning.,"Significant decrease in hyperactivity on three measures, hyperactivity factor, restless/overactive item on the PTQ, and activity on the computer.",,,,"Minimal side effects, which included, excessive sedation, decreased appetite, and vomiting.",,,"21 white; 3 African-American (""Race was not associated with socioeconomic status in this sample.""",,,,,,,,
Olanzapine,,Yes,"Hollander, Eric",,,2006,Journal of Child and Adolescent Psychopharmacology,Randomized Double-blind Placebo Controlled   - Pilot,8 weeks,11,,6-14 y,7.5-12.5 mg/d; mean: 10 (SD: 2.4 mg/d),Irritability,CGI-I,Olanzapine was superior to placebo on CGI-I scores.,Stereotypic and repetitive behaviors,CY-BOCS and OAS-M,No differences between tx groups.,Weight gain and sedation. Well tolerated.,Generally safe. No dyskinesia or EPS.,n=3,,Very small treatment group.,,,,,,,
Omega-3 Fatty Acids,,,"Bent, Stephen",,No conflicts of interest reported. ,"August 4, 2010",Springer Link,Randomized Double-blind Placebo Controlled  ,12 weeks,27,Not reported. ,3-8 years; Mean 5.8 years,1.3 g/d,Hyperactivity,ABC Hyperactivity,No statistically significant changes in scores. Trends could show small to moderate improvements in hyperactivity with Omega fatty acids. ,,"ABC Irritability, Stereotypy, Lethargy, Inappropriate speech; PPVT; EVT; SRS; BASC; ",No statistically significant changes in scores. ,"Well tolerated. AEs included rash, upper respiratory infection, and GI issues. ",No treatment related serious AEs. ,n=8,Not reported. ,,,,,,,,
"N-Acetylcysteine (NAC), oral",Yes,Yes,"Hardan, Antonio",10.1016/j.biopsych.2012.01.014.,"Bristol-Myers Squibb Co., Forest Pharmaceuticals, Shire Development, Inc. and Bioadvantex, Inc. ","June 1, 2012",Biological Psychiatry ,"RPCT, Pilot",12 weeks,33,31 M: 2 F,"3-10 y, Mean: 7 y","max: 2700mg/d; 900mg/d for the first 4 weeks, 900mg BID  for the next 4 weeks; 900mg 3x/day for the remainder.  ",Irritability,Aberrant Behavior Checklist-Irritability subscale (ABC-I) and DOTES,NAC treatment resulted in significant improvements in irritability scores. ,Social and repetitive/stereotypic behaviors. ,"ABC-Stereotypy subscale, Repetitive Behavior Scale - Revised (RBS-R), Social Responsiveness Scale (SRS), and CGI-I ",NAC treatment resulted in improvement of stereotypic/repetitive behvaior on the ABC and significant improvement on the RBS-Stereotypies. No significant difference in the SRS. ,Well tolerated with limited side effects. Most AEs were gastrointenstinal. ,Minimal AEs. One participant experienced worsening of agitation and irritability. ,n=4 ,"""There were no differences between the placebo group and active group on any of the demographic and clinical baseline measures.""",,,,,,,,
Oxytocin,n/a,n/a,"Sikich, Linmarie",10.1056/NEJMoa2103583,No conflcits of interest,October 2021,The New England Journal of Medicine,RCT,24 weeks,277,142 M: 35 F,3-17 y (mean: 10.4 y SD: 4.0),48 IU-80 IU daily; mean maximal daily dose: 69 SD: 16.9 IU,Social functioning,ABC modified Social Withdrawal subscale (ABC-mSW),No significant difference between treatment grooups.,Social functioning,SRS-2 Social Motivation subscale (SRS-2-SM); Sociability Factor; and SB5 Abbreviated IQ,No significant difference between treatment groups.,"Higher incidences of increased appetite, increased energy, restlessness, increased thirst, and inattention in the oxytocin group",1 serious AE related to oxytocin (sedation while driving),"n=27 (14 OXT, 13 placebo)",204 white; 23 black; 23 Asian; 23 multiracial; 28 Hispanic,Flexible dose strategy used could be a limitation,low risk - Centralized randomization table,"Low risk - Drug container system, volume, labeling, and other features were matched.",Low risk - All outcome assessors were blinded.,Low risk - Clinicians and participants were blinded.,Low risk - All outcome data provided.,Low risk - All outcomes reported. Negative and insignificant outcomes reported.,
Oxytocin ,n/a,n/a,"Yamasue, Hidenori",10.1038/s41380-018-0097-2,,2020,Molecular Psychiatry,Randomized Double-blind Placebo Controlled  ,6 weeks,106,,18-48 y,48 IU/d,,ADOS; oxytocin plasma levels,"Both placebo and oxytocin treatment groups had reduced scores, no treatment difference. Plasma oxytocin elevated over course of trial in oxt treatment group compared with placebo group.",,"ADOS repetitive behavior, duration of gaze fixation",Oxt treatment reduced ADOS repetitive behavior scores and duration of gaze fixation in social regions. ,Well tolerated. One pt had temporary gynecomastia during Oxt treatment. ,,,,,,,,,,,
Oxytocin + Probiotic,,,"Kong, Xue-Jun",10.3390/nu13051552,,May 2021,BMC,Randomized Double-blind Placebo Controlled  - Pilot,,35,26 M: 9 F,3-20 y; Mean:10.30 y,Oxytocin (titrated to max dose of 32 IU/d) + PS128 probiotic ( 6x10^10 CFUs) or + placebo,Social interest & interaction; core ASD symptoms,caregiver-rated Social Responsiveness Scale (SRS) & caregiver-rated Aberrant Behavior Checklist (ABC),"The probiotic + OXT group had improvements on ABC and SRS. Most improvement was on the ABC total and stereotyped behavior scores, and the SRS cognition subscale. ","GI symptoms, global functioning, and blood samples",Blood sample collection & circulating biomarker analysis; GI severity index (GSI); Clinical Global Impression (CGI),No change in GI severity. The combination treatment group showed significant improvement of CGI. ,,,n=4,28 Asian; 1 Hispanic; 6 White,,Low risk - computer generated,Low risk - Drug containers and capsules were identical in appearance and prepared by pharmacy. ,Low risk - Assessors were blinded to treatment allocation,Low risk - Participants blinded to treatment allocation,,,
Paliperidone,No,No,"Stigler, Kimberly A.",,,"May 3, 2012",Psychopharmacology,,,30,,,,,,,,,,,,,,,,,,,,,
Pentoxifylline + Risperidone,,,"Akhondzadeh, Shahin",,,2009,Progress in Neuro-Psychopharmacology and Biological Psychiatry,Randomized Double-blind Placebo Controlled ,10 weeks,40,,4-12 y,"Risperidone- 3 mg/d + pentoxifylline- 600 mg/d, or + placebo",Core symptoms of ASD,ABC-C,"Pentoxifylline tx group had greater reduction in subscales for irritability, lethargy/social withdrawal, stereotypic bx, hyperactivity/noncompliance, inappropriate speech",,none,n/a,,,,,https://www.sciencedirect.com/science/article/abs/pii/S0278584609003091,,,,,,,
Piracetam + Risperidone,yes both,yes (risperidone),"Akhondzadeh, Shahin",,None reported. ,"October 11, 2007",Child Psychiatry and Human Development,Randomized Double-blind Placebo Controlled  ,10 weeks ,40,30 M: 10 F,3-11 y; Mean: 6.8 y,Risperidone: 2 mg/d for children 10-40 kg; 3 mg/d for children 40 kgo; Piracetam: up to 800 mg/d,Core symptoms of ASD,ABC-C Rating Scale (total score) ,Scores improved with piracetam ,,None,N/A,"There were no differences in side effects or the frequency between treatment groups. The most common side effects were daytime and morning drowsniess, and increased appetite. ",No serious or severe side effects. ,None,Not reported.,"Risperidone adjuvant piracetam proved to show markedly greater improvements in ASD symptoms than risperidone by itself. ""The results suggest that a combination of atypical antipsychotic medications and a glutamate agent such as piracetam, might have increase synergistic effects..."" when treating disruptive symptoms in ASD. ",,,,,,,
Prebiotic + exclusion diet,n/a,n/a,"Grimaldi, R.",https://doi.org/10.1186/s40168-018-0523-3,Clasado Research Services Ltd (provided prebiotic and funding),2018,Microbiome,RCT,6 weeks,41,31 M: 10 F,4-11 y; mean: 7.7 y,"prebiotic B-GOS mixture (Bimuno, 80% GOS content): 1.8 g, and exclusion dieet (gluten and casein free)",Social behaviors and anxiety,ATEC (anti-sociability); AQ (social skills); EQ-Sq; SCAS-P,"Overall severity of behavioral traits were not significantly affected. However, reduced anti-social behavior in concurrent with an improvement in social skill scores were seen in children on the combination of exclusion diet and prebiotics. ","GI Symptoms, urine spectra profiles, fecal samples, sleep","abdominal pain, bowel movement, bloating, flatulence, and stool form; urine samples; stool samples; sleep diary",B-GOS led to significant alterations in urine spectra profiles and metabolic shifts in fecal samples. No significant change in GI symptoms or sleep patterns. ,Well tolerated - minor severity diarrhea,Generally safe - no serious AEs,n=4,Not reported,"Four arm trial - exclusion diet + B-GOS, exclusion diet + placebo, unrestricted diet + B-GOS, unrestricted diet + placebo",Low risk,Low risk,Low risk,Low risk,High risk,Low risk,
Probiotics,,,"Arnold, Eugene ",,,"November 9, 2019",Journal of Child and Adolescent Psychopharmacology,RPCT - Pilot ,8 weeks ,13,,3-12 years,,GI symptoms.,PedsQL GI module,,,"Gut microbiota analysis, PRAS-ASD, and parent-selected target symptoms",,,,,,,,,,,,,
Probiotics (visbiome/vivomixx),,,"Arnold, Eugene",,,2019,Journal of Child and Adolescent Psychopharmacology,RPCT- Pilot,19 weeks,13,6 M: 4 F,3-12 y; Mean: 8.8 y,,Gastrointestinal symptoms.,Pediatric Quality of Life Inventory GI Module,,,"gut microbiota analysis, the parent-rated anxiety scale for ASD, and parent-selected target symptoms",,"Decreased appetite, enuresis, encopresis",,n=3,5 Black; 3 white; 2 other/multiracial,,,,,,,,
Probiotics (visbiome/vivomixx),,,"Santocchi, Elisa",https://doi.org/10.3389/fpsyt.2020.550593,None,September 2020,Frontiers in Psychiatry,RCT,6 months,85,84% M,18-72 mo; mean: 4.2 y,"2 packets/day in first month, then 1 packet/day for the remainder",Core symptoms and GI symptoms,ADOS-CSS,No differences in ADOS-CSS.,"Adaptive functioning, social behaviors, severity of GI symptoms, restricted and repetitive behaviors","VABS-II; Total GSI; SCQ; RBS-R; CBCL 1, 5-5; PSI; Plasma levels of leptin, TNF-a, IL-6, PAI-1, and fecal calprotectin levels","Greater improvement in GI symptoms, adaptive functioning, and sensory profiles with probiotic supplementation. ",,,,,,Low risk - Computer generated randomization,Low risk - Placebo and probiotic packaging and organoleptic characteristics were identical. Administration instructions were the same.,Low risk - All outcome assessors were blinded.,"Low risk - Clinicians, patients, and families all blinded.",Low risk - All assessment scores reported and all adverse effects reported in statistics table.,"Low risk - All outcomes reported, included significant and insignificant.",
Probiotics,,,Parracho,,,2010,,RCT - crossover,3 weeks,62,,4-16 y,L. plantarum WCFSI 45 billion CFU/capsule,Behavioral symptoms,"DBC-P, TBPS",,GI Symptoms,,,,,,,,Low risk,,,,,,
Probiotics (Lactobacillus plantarum PS128),No,No,"Liu, Yen-Wenn",10.3390/nu11040820,"Bened Biomedical Co., Ltd.",April 2019,Nutrients,RCT,4 weeks,80,All male,7-15 y (mean: 10.01 SD: 2.32),3 x 10^10 CFU/capsule of PS128,Core symptoms,"ABC-Taiwan version, SRS, CBCL","Subjects in the PS128 group showed nominal improvements in ABC-T-body and object use, SRS-total score, CBCL-anxiety and CBCL-rule breaking behavior. No significant between-group differences in most ABC-T subscales or CBCL subscales.",Core symptoms,SNAP-IV Chinese version; CGI-I,"PS128 group showed nominal improvements in SNAP-IV-hyperactivity/impulsivity, oppoition/defiance, and SNAP-IV-total score (greater improvement in younger subjects, 7-12 yrs). No between-group difference in CGI-I or SNAP-IV inattention.",No AEs reported,Generally safe,n=9,,,"Low risk - Randomized using treatment codes, performed by a research assistant who had no contact with participants","Low risk - PS128 and placebo capsules were identical in taste, appearance, and storage.",Low risk - All outcome assessors were blinded.,Low risk - Clinicians and participants were blinded,Low risk - All baseline and endpoint outcome data reported.,"Low risk - All outcome data reported, including insignificant findings.","Bened Biomedical Co provided PS128. Funded by Bened Biomedical Co., Ltd., one author/investigator owns stock in Bened Biomedical Co., Ltd. "
"Melatonin, Prolonged Release ",,,"Schroder, Carmen M.",10.1089/cap.2018.0020,,"May 11, 2019",Journal of Autism & Developmental Disorders,Randomized Double-blind Placebo Controlled  ,13 weeks,125,92 M: 33 F,2-17.5 y; Mean: 8.7 y (SD: 4.15),2-5 mg,Sleep habits and quality of life.,Strengths and Difficulties Questionaire; Caregiver's quality of life,"Prolonged release melatonin tx resulted in significant improvents in externalizing bx, Caregivers quality of life improved and correlated with the change in total SDQ.",,,,,,n=24 (7 PedPRM),112 white; 9 black or african american; 6 other; 2 Asian,"""PedPRM alleviates insomnia related difficulties, particularly externalizing behavior in the children, subsequently improving caregivers' quality of life."" ",,,,,,,
"Melatonin, Prolonged-release ",,,"Gringras, Paul",,"Neurim Pharmaceuticals, Akili, Alcobra, KemPharm, Pfizer, Purdue, Roche, Sage, Shire, Sunovion, Supernus Pharmaceuticals, Syneurx, Takeda, Teva, Touchpoint, Tris, Validus, and WebMD",November 2017,Journal of the American Academy of Child and Adolescent Psychiatry ,Randomized Double-blind Placebo Controlled  ,13 weeks,125,92 M: 33 F,2-17 y; Mean: 8.7 (SD: 4.15 y),2-5 mg,Sleep habits.,SND-reported total sleep time,Melatonin treated participants slept an average of 57.5 minutes longer than placebo. ,Sleep latency. ,"Sleep latency, duration of wake after sleep onset, mean number of awakenings, and mean longest sleep episode ","Sleep latency decreased by 39.6 minutes with PedPRM, without earlier wake up time. ",Few and mild AEs. Headaches and daytime somnolence increased in melatonin tx group. ,"Severe AEs reported by 13 pts in PedPRM group, these included agitation, fatigue and mood swings. ",,112 white; 9 black; 2 Asian; 6 other,,,,,,,,
Propranolol,Yes,No,"Williams, Daniel T. ",,Not reported,1982,Journal of the American Academy of Child and Adolescent Psychiatry,Retrospective study,2.5 years,30,26 M: 4 F,"7-35 y (11 children, 15 adolescents, 4 adults)",50-960 mg/d; mean: 160 mg/d,Rage outbursts,Pattern of uncontrolled rage outbursts,Over 75% of patients showed marked improvement w/ usage of propranolol,Uncontrolled seizures,Uncontrolled seizures,Only 1 out of 11 patients with seizures did propranolol show improvement. ,"Somnolence, lethargy, hypotension. ",One serious AE of bradycardia. One patient experienced extreme worsening depression which was alleviated with lower dosage. ,,,,,,,,,,
Propranolol or nadolol,Yes,No,"Narayanan, Apanth",10.1007/s11682-010-9098-8,,2011,Brain Imaging and Behavior,Pilot open label imaging study,,,,,,,,,,,,,,,,,,,,,,,
rTMS,n/a,n/a,"Ameis, Stephanie",doi:10.1016/j.brs.2020.01.007.,Brainsway Ltd,2020,Brain Stimulation,RCT - sham controlled,4-weeks (20-session),40,28 M: 12 F,16-35 y ,20 Hz rTMS targeting DLPFC,Executive functioning,"BRIEF-SR, BRIEF-A, BRIEF-MCI, CANTAB SWM task",Baseline SWM total errors and BRIEF-MCI scores predicted treatment outcome. ,Potential moderators,VABS-II and gender,Baseline adaptive functioning and gender possibly moderated effects of rTMS. More severe adaptive functioning deficits at baseline showed more improvement with rTMS. Spatial working memory showed greater improvement in females than in males. ,No group differences in side effects,No severe AE,n=2 (in rTMS group after 1-2 sessions),,,Low risk - computer-generated 1:1 allocation with a random number that a research assistant concealed ,"Low risk - Allocation concealed using sealed, opaque envelopes. ","low risk - Study investigators, clinical/cognitive raters were blinded","Low risk (?) - Clinicians and participants remained blinded. rTMS technicians were aware of group assignment, but were not involved in allocation or clinical/cognitive assessment. ",No - all data reported,No - Insignificant outcomes were reported.,
Repetitive transcranial magnetic stimulation (rTMS),n/a,n/a,"Ameis, Stephanie",,No conflicts of interest. ,2017,Journal of Child and Adolescent Psychopharmacology,Randomized Double-blind Placebo Controlled  ,4 weeks,40,Not reported. ,16-35 years,20 Hz rTMS applied to dorsolateral prefontal cortex,,Cambridge Neuropsychological Test Automated Battery (CANTAB) spatial working memory task,,,,,No seizures. Side effects were transient and mild. ,Generally safe. No lasting adverse effects. Inadvertent induction of a seizure are monitered. ,,,All psychiatric medications were continued throughout trial. ,,,,,,,
Resveratrol + risperidone,yes both,Yes (risperidone),"Hendouei, Fatemeh",10.1111/jcpt.13076,No conflicts of interest,2020,Journal of Clinical Pharmacy and Therapeutics,Randomized Double-blind Placebo Controlled ,10 weeks,62,50 M: 12 F,mean (resveratrol): 7.8 y (SD:2.1); mean (placebo): 8.1 y (SD: 1.9),"risperidone: and resveratrol: 250 mg BID, or plus placebo",Irritability,ABC irritability,No time x treatment differences in resveratrol and placebo groups. ,"Hyperactivity/non-compliance, lethargy/social withdrawal, stereotypy, and inappropriate speech",ABC-C (all subscales),"Significant time x treatment effect on hyperactivity/non-compliance for the resveratrol group compared to placebo. No time x treatment differences in ABC lethargy/social withdrawal, stereotypic behaviour, and imappropriate speech subscales.","No differences in rates or severity of AEs between groups.Restlessness, constipation, diarrhoea (resveratrol), increased appetite (placebo)",No serious AEs,n=0,Not reported,,Low risk - Randomized computer generated codes assigned to each patient.,"Low risk - Assignments in confidential sealed envelopes until study endpoint. Placebo and resveratrol were identical in shape, size, colour, and taste.",Low risk - All outcome assessors were blinded.,"Low risk - Clinicians, patients, and families all blinded.",Low risk - All assessment scores reported and all adverse effects reported in statistics table.,"Low risk - All outcomes reported, included significant and insignificant.",Overall low risk
Riluzole,Yes,No,"Wink, Logan K.",,No conflicts of interest. ,"Aprill 11, 2018",Journal of Autism & Developmental Disorders,Randomized Double-blind Placebo Controlled   - Crossover,12 weeks ,8,7 M:1 F,13.1-18.45 y; mean: 16.02 y,200 mg/d,Irritability,ABC-Irritability,No significant treatment effect on irritability.,,,,Well tolerated.,Generally safe. No serious Aes,n=1 (worsening aggressive bx),5 white; 1 African-American; 1 hispanic,,,,,,,,
Riluzole + Risperidone,Yes,Yes (risperidone),"Ghaleiha, Ali",,No conflicts of interest or commercial funding.,"July 3, 2013",Pediatric Drugs,Randomized Double-blind Placebo Controlled ,10 weeks,49,33 M: 7 F,5-12 y; mean: 7.6-8.4 y,Risperidone- 2 or 3 mg/d (both based on body weight) + Riluzole- 50 or 100 mg/d; or + placebo,Irritability,ABC-C Irritability score,There was a significantly greater improvement in ABC-C irritability scores in the riluzole tx group (p=0.03). ,"Lethargy/social withdrawal, stereotypy, and hyperactivity/noncompliance",Other ABC-C subscales and CGI-I scores,"The riluzole group showed greater improvement on ABC-C lethargy/social withdrawal (p=0.02), stereotypic behavior (p=0.03), and hyperactivity/non-compliance (p=0.005) scales. The riluzole pts also showed more clinical improvement on CGI-I. No improvement on the inappropriate speech scale. ",Generally well tolerated. The riluzole tx group had more frequent increases in appetite and weight gain. The frequency of other side effects were the same in both tx groups. Common AEs included morning drowsiness and increased salivation. ,"Generally safe. However, riluzole added to risperidone can increase chances of increased bodyweight and appetite in pts.",n=9 (5 riluzole),Not reported. No significant differences between tx group baseline characteristics.,"""...Significance was reached on the irritability and hyperactivity/noncompliance subscales scores by the middle of the trial, suggesting an early impact of riluzole on behavioral disturbances. This finding is congruent with the formerly evident concept that pharmacological treatments are more efficient in ameliorating comorbid symptoms than in ameliorating core deficits in patients with autism"". ",,,,,,,
Risperidone,Yes,yes,"Aman, Michael",10.1089/cap.2007.0133,"Affiliations with Bristol-Meyers Squibb Co, Johnson and Johnson, Forest Research Institute, Neuropharm, Supernus, Novartis, Organon, Janssen, and McNeil.",2008,Journal of Child and Adolescent Psychopharmacology,Randomized Double-blind Placebo Controlled ,8 weeks,38,9 F: 29 M,5-18 y,0.5-3.5 mg/d,Cognition,Sustained attention; hand-eye coordination; verbal learning; and spatial memory. Cancellation Task and Verbal Learning Task scores. ,"There were no declines in attention, hand-eye coordination, or short term verbal memory. Significant improvement in the Cancellation Task and Verbal Learning Task scores in the treated group. ",,None,N/A,None Reported,None reported,,81.57% White; 5.26% Black; 7.89% Asian/Pacific Islander; 5.26% Hispanic,"Affiliations with Janssen, who manufactures risperidone and is also the company who assigned the drug order.","Unclear Risk - The study does not report how the randomization was carried out, or even that the sequence was randomized. ",Unclear risk - method of allocation not reported,"Unclear risk - ""Matched placebo and risperidone were provided by the manufacturer (Janssen Pharmaceuticals) in tablet form."" Tablet form, color, or taste was not reported. Flexible dosing, concealment for differences in dosage not described. ",,Low risk - Data for all primary outcome measures were reported in a table with the baseline scores. ,Low risk,Conflicts of interest include Janssen (manufacturer of risperidone) and Johnson & Johnson.
Risperidone,Yes,yes,"Kent, Justine",10.1007/s10803-012-1723-5,"Janssen, Bristol-Myers Squibb, Pfizer, Purdue Pharma, Forest",December 2012,Journal of Autism & Developmental Disorders,Randomized Double-blind Placebo Controlled ,,96,,5-17 y,"low dose: 0.125�mg/d [20 to <45�kg], 0.175�mg/d [>45�kg]; or high-dose: 1.25�mg/day [20 to <45�kg], 1.75�mg/day [>45�kg]) or placebo",Irritability,ABC irritability subscale,High dose risperidone treatment group had significant improvement in scores. Low dose and placebo had no difference in baseline to endpoint scores.,Severity and repetitive/stereotypic behaviors,CGI severity; YBOCS,"CGI and YBOCS scores improved significantly in the high dose risperidone group, no improvement in the low dose or placebo groups. ","Increased appetite, somnolence, and sedation in the high dose risperidone group. ",,,,,,,,,,,
Risperidone ,Yes,yes,"McCracken, James ",,No conflicts of interest. ,"August 1, 2002",The New England Journal of Medicine,Randomized Double-blind Placebo Controlled ,8 weeks ,101,82 M: 19 F,5-17 y; Mean: 8.8 y,0.5-3.5 mg/d; Mean: 1.8 mg/d,Irritability,Abberant Behavior Checklist- Irritability subscale (ABC-I),Treatment with risperidone resulted in a higher rate of reduction in the irritability subscore than placebo. ,Global severity,Clinical Global Impressions-Improvement (CGI-I Score); VABS,The rate of positive response was higher in the risperidone group than the placebo. ,Well tolerated. Mild to moderate AEs. Common side effects included weight gain. ,"One severe headache. However, 'the short period of this trial limits inferences about adverse effects such as tardive dyskinesia'. ",6% Risperidone; 35% placebo ,Not reported. , ,High risk - randomization method not reported,Unclear risk - method of allocation concealment not reported,"Unclear risk - Study does not state outcome assessors were blinded, only states that clinicians and participants were blinded",Low risk - Clinicians and participants were blinded to allocation,Unclear risk - All measures baseline scores were reported. CGI and VABS endpoing scores not reported in results table. ,"Unclear risk - Endpoint scores for ABC irritability were the only reported in the table, though baseline scores for CGI, VABS, and ABC were reported. No endpoint data on VABS to know if there was worsening of scores or insignificant changes. ",
