treatment_name,liquid_available,odt_available,first_author,doi,commercial_affiliation,publication_date,journal,study_type,duration,sample_size,gender_ratio,age_range,dose_range,primary_outcome_area,primary_outcome_measures,primary_results,secondary_outcome_area,secondary_outcome_measures,secondary_results,side_effects,safety_rating,dropout_rate,race_ethnicity,notes,sequence_generation_bias,allocation_concealment_bias,outcome_assessor_blinding_bias,clinician_blinding_bias,attrition_bias,reporting_bias,bias_notes
Guanfacine (ER),No,No,"Scahill, Lawrence",10.1176/appi.ajp.2015.15010055,"Shire Pharmaceuticals provided guanfacine and placebo. Bracket, Coronado, MedAdvante, Neuren, Roche, and Shire. Seaside Therapeutics. ","August 28, 2015",The American Journal of Psychiatry  ,RCT - multisite,16 Weeks,62,9 F: 53 M,5-14 y; Mean: 8.5 y,1-4 mg/d; mean: 3 mg/d,Hyperactivity,. Aberrant Behavior Checklist- Hyperactivity Subscale (ABC-H),"""Guanfacine was superior to placebo on the parent-rated Aberrant Behavior Checklist-hyperactivity subscale"" A 43.6% decline in the scores of the guanfacine group, compared to a 13.6% decrease in the placebo group. ",,Clinical Global Impressions-Improvement (CGI Scores) and the ADHD Rating Scale scores,"Guanfacine showed more improvement than placebo  in the ADHD Rating Scale scores, as well as, a higher rate of positive response on the CGI scores. There was a 50% positive response in the treated group compared to 9.4% in the placebo. ","Lowered blood pressure was the most common side effect. Nine subjects lowered dosages, because of effects such as, drowsiness, irritability, sleep reduction, or emotion dysregulation (""emotionally fragile or tearful and cranky""). ",Two participants dropped out due to Aes. One child had a serious AE and discountinued guanfacine. He became physically and verbally aggressive towards his mother and hospital personnel.,n=8;  All dropouts due to lack of efficacy.,30 White; 11 Black; Asian; 2 Pacific Islander; 4 Mixed,,"Unclear risk - method of sequence generation not described; ""eligible subjects were randomly assigned within site without stratification in a 1:1 ratio...""",Low risk - Permuted blocks used for allocation concealment. ,,,,,
Haloperidol,Yes,,"Campbell, M",,,1982,Journal of Autism & Developmental Disorders,Randomized Double-blind Placebo Controlled ,12 weeks ,42,,2.6-7.8 y,,Stereotypy and social withdrawal.,Stereotypy and social withdrawal subscales of CPRS.,Haloperidol was superior to placebo on sterotypy and social withdrawal scores.,,,,Sedation and acute dystonic reactions.,Acute dystonic reactions in 2 pts.,,,"There was more of a ""positive impact on learning when haloperidol treatment was combined with language training"".",,,,,,,
Haloperidol,Yes,,Anderson,,,1989,Journal of Autism & Developmental Disorders,Randomized Double-blind Placebo Controlled ,14 weeks,45,,2.3-7.9 y,,Withdrawal and stereotypy,CPRS,Haloperidol superior to placebo on all subscales of CPRS. No significant treatment benefit in irritability symptoms. ,,,,"Sedation, increased irritability","Shown to have long term safety and efficacy, though there is risk for dyskinesia. ",,,,,,,,,,
Intranasal Oxytocin,,,"Anagnostou, Evdokia",,"Proximagen, Neuropharm, Seaside Therapeutics, and Novartis",2012,Anagnostou et al. Molecular Autism,RPCT- Pilot ,6 weeks,19,16 M: 3 F,Mean: 33 y,24 IU BID,,Social function/cognition (Diagnositic Analysis of Nonverbal Accuracy) and repetitive behaviors (Repetitive Behavior Scale-Revised),No significant changes in primary outcome measures. ,"Social, obsessive behaviors, and emotional states. ","Social Responsiveness Scale, Reading-the-Mind-in-the-Eyes Test and Yale Brown Obsessive Compulsive Scale - compulsion subscale, and quality of life (World Health Organization Quality of Life Questionnaire - emotional/social subscales)","Improvements in the measurements of social cognition, Reading-the-Mind-in-the-Eyes Test and quality of life. ",Well tolerated. ,No serious adverse effects. ,n=3,73.7% White; 5.2% Black; 5.2% Hispanic; 10.5% Asian; 5.2% Other,IN-OXT has a very short half-life in the blood. ,,,,,,,
Intranasal Oxytocin,,,"Parker, Karen",,No conflicts of interest. ,"July 25, 2017",PNAS,RPCT - Parallel design,4 weeks,32,27 M: 5 F,"6-12 years, Mean: 8/9 years",24 IU BID,Social behaviors. ,Improvement in social abilities measured by the Social Responsiveness Scale (SRS).,"Oxytocin significantly enhanced social abilities in participants. ""individuals with the lowest pretreatment OXT concentrations showed the greatest social improvement""",,Treatment efficacy in nonsocial symptom domains and OXT safety/tolerability. ,,Well tolerated with minimal side effects. Increase in blood pressure in OXT treated participants. ,,n=2 ,14 white; 9 asian; 9 other,,,,,,,,
Lamotrigine,No,Yes,"Belsito, Karin M.",,Glaxco-Wellcome,2001,Journal of Autism & Developmental Disorders,Randomized Double-blind Placebo Controlled  - Parallel,18 weeks ,28,27 M:1 F,3-11 y; mean: 5.8 y,mean: 5.0 mg/kg/d,,"ABC, Autism Bx Checklist, Vineland Bx Scales, PL-ADOS, or CARS",No significant results in diference between tx groups.,,,,Insomnia and hyperactivity. Well tolerated with limited side effects.,"No rashes. 6 pts dropped out due to adverse events (insomnia, increased stereotypies and aggression)",n=7,89.5% white Lamotrigine group; 66.7% white in placebo group,,,,,,,,
L-Carnosine,,,"Mehrazad-Saber, Zahra",,No conflicts of interest.,"January 30, 2018",Basic & Clinical Pharmacology & Toxicology,Randomized Double-blind Placebo Controlled  ,2 months,43,31 M: 12 F,,500 mg/d,Sleep habits and autism severity.,Children's Sleep Habits Questionnaires and Gilliam Autism Rating Scale 2,"Did not change autism severity. Signficantly reduced sleep duration, parasomnias, and total sleep disorders score by 7.59%.",,,,,,n=7,,,,,,,,,
Levetiracetam,,,Wasserman. Stacy,10.1097/01.yic.0000224787.13782.0f,,November 2006,International Clinical Psychopharmacology,Randomized Double-blind Placebo Controlled ,10 weeks ,20,17 M: 3 F,5-17 y ,20-30 mg/kg/d,Global improvement,CGI-I,No significant improvement.,"Aggression, affective instability, repetitive behaviors, impulsivity, and hyperactivity",ABC parent and teacher ratings; CY-BOCS; Conners' Rating Scale-Revised: Long version for parent and teacher,No significant change in any secondary measures.,,,,,,,,,,,,
Levocarnitine,,,"Geier, David",PMID: 21629200,No conflicts of interest,"June 1, 2011",Medical Science Monitor,Randomized Double-blind Placebo Controlled  ,3 months,30,4 F: 23 M,3-10 y,50 mg L-cartinine/kg bodyweight/day,,"Childhood Autism Rating Scale (CARS), hand muscle testing, and modified clinical global impression (CGI) forms",Significantly improved clinical measurements over time. ,,"Serum free-carnitine. Autism Treatment Evaluation Checklist (ATEC), treatment adherence measurement (TAM), frequency and intensity of side effect rating (FISER)/global rating of side effect burden (GRSEB)/patient report of incidence of side effects (PRISE) forms","""Significant correlations between increasing serum free-carnitine levels and positive outcomes on clinical measurements""",Well tolerated. Side effects included irritability and/or stomach discomfort. ,Minimal AEs.,"n=4 L-Carnitine; 1 AE, 2 non-compliance, 1 lost to follow-up ",21 White; 6 'minorities',,High risk - Participants were assigned to groups with a coin flip by a study investigator. This investigator was not involved in efficacy measurements,"Unclear risk - Participants were shipped either placebo or levocarnitine. No statements on the blinding of formulation of the placebo or levocarnitine (i.e. taste, shape, color, etc..)",Low risk - Assessors were blinded,Low risk - Participants and clinicians were blinded. ,Low risk - All baseline and endpoint scores on all measures reported. ,Low risk - All data reported. ,
Lovastatin & parent implemented language intervention (PILI),,,"Thurman, Angela",,,April 2020,Journal of Neurodevelopmental Disorders,Lovastatin (RPCT) & open-label PILI,20 weeks,32 (30 analyzed),28 M: 2 F,,max: 40 mg/d,"Language, nonverbal cognition",3 language samples (storytelling); ADOS-2; Leiter-R; PPVT-4; EVT-2,,Maladaptive behavior,RBS-R; ABC-C total,,,,n=2,24 Caucasian; 4 Hispanic; 1 African American; 1 Asian,,,,,,,,
Lurasidone,No,No,"Loebel, Antony",,Sponsored by Sunovion Pharmaceuticals,"December 11, 2015",Journal of Autism & Developmental Disorders,Randomized Double-blind Placebo Controlled  - Fixed dose,6 weeks,150,121 M: 29 F,6-17 y; Mean: 11 y,20 mg/d or 60 mg/d,"Irritability, aggression, and SIB","Irritability, agitation, and/or self-injurous bx. Measured by the ABC-I",No change between tx groups for ABC-I scores. Not effacacious in short term tx of moderate-to-severe irritability. ,Obsessive compulsive behaviors.,CGI-I; CGI-S; CY-BOCS Compulsions; CGSQ global strain,"""Significantly greater improvement was observed at endpoint on the CGI-I scale for the lurasidone 20mg/day group compared with the placebo group"". No improvements on any of the other secondary outcome measures. ",Side effects included vomiting and somnolence. ,"Majority of the AEs were mild or moderate. 12% of AEs were severe in the lurasidone 20mg tx group. Serious treatment emergent Aes were arm fracture (n=3), increased irritability, and appendicitis. ","Discontinuation rates due to aes were: lurasidone 20mg/day, 4.1%; 60mg/day, 3.9%; and placebo, 8.2%",114 White; 24 Black; 10 Other,,,,,,,,
Mecamylamine,,,"Arnold, Eugene",,Dr. Aman and Dr. Arnold have received consulting honoraria and research support from multiple pharmaceutical companies.,2012,Journal of Child and Adolescent Psychopharmacology,Randomized Double-blind Placebo Controlled  - Pilot,14 weeks,20,17 M: 3 F,4-12 y; Mean: 7.4 y (SD: 2.55),"0.5 mg/d for 6 weeks - 2.5 mg for 2 weeks - then, 5 mg/d for 6 weeks.",,Ohio Autism Clinical Impressions Scale (OACIS) and OARS-4 ,"90% of the treatment group showed improvement, but only 40% sustained it. Better outcomes are more likely with lower mg/kg and longer medication duration.  Participants treated with a max dose of 0.13-0.15 mg/kg/d had a better outcome w/ sustained improvement, than those who regressed at doses ? 0.18mg/kg/d. ",,"Repetitive Behavior Scale, the Abberant Behavior Checklist, the Social Responsiveness Scale, and target symptom assessment",No significant improvements on any secondary measure. ,Well tolerated. Constipation was common. ,Safe. No dose reduction because of Aes,n=2 ,17 White; 2 Asian; 1 other,"""Mecamylamine appeared to be safe, but not very effective in autism. The suggestion of better results at lower doses and longer exposure warrants consideration for future trials. The next step would be exploration of a more specific a4b2 nAChR agonist, such as varenicline.""",,,,,,,
Melatonin,Yes,Yes,"Hayashi, M",0.1007/s10803-021-05139-w,Nobelpharma,"June 7, 2021",Journal of Autism & Developmental Disorders,RCT - Open-label,"56 days (14 d RCT, 52 d open-label)",196,121 M: 75 F,6-15 y; mean: 11 y,"1 mg, 4 mg, or placebo",Sleep onset latency,Sleep onset latency (SOL),"SOL shortened significantly in both melatonin groups compared to placebo group. However, SOL did not change in the subgroups: �female,�  �previous  history  of  ramelteon  treatment,�  and height ? 145 cm. 4-mg treatment shortened SOL in all participant subgroups. ",Sleep variables: Total sleep time (TST); sleep efficiency (SE); changes in aberrant behaviors,"Number of awakenings after sleep onset, wakening time after sleep onset, ABC","TST and the number of wakenings did not change in any melatonin groups. SE improved significantly in the 4-mg group. In the 1-mg melatonin group, wakening time after sleep onset extended significantly. No changes in ABC. ",Highest rates of AEs reported in the 4 mg group. Most common side effects were infections and infestations. ,Generally safe. 2 patients had serious worsening of irritability.,n=9,Not reported,"Study assessed efficacy of melatonin supplementation with adequate sleep hygeine. ""2 children were admitted to the hos-pital due to the abrupt deterioration of irritability�one of the aberrant behaviors of ASD�on the next day of the last medication. Hence, these episodes advert clinicians to be cautious when modi-fying the therapeutic intervention for children with ASD"".",Low risk - Computer generated randomization. ,Low risk - Independent third party ensured each treatment was indistinguishable. ,Low risk - All personnel in this study were blinded to treatment allocation,Low risk - Patients and clinicians were blinded to allocation and were given the same instructions. ,Low risk - All primary and secondary outcome results were reported,Low risk - Insignificant results reported. ,"Nobelpharma sponsored this study and provided the drugs for this study. However, risk of biases remain low, according to Cochrane's assessment. "
Memantine + Risperidone,Yes (memantine peppermint) ,,"Ghaleiha, Ali",https://doi.org/10.1017/S1461145712000880,None. ,5/1/2013,International Journal of Neuropsychopharmacology,Randomized Double-blind Placebo Controlled ,10 weeks,40,23 M: 17 F,4-12 y; mean: ~7.5 y,"risperidone- 2 mg/d & memantine- max: 15 mg/d for pt 10-40 kg, 20 mg/d for pt 40 kgo, or + placebo",Irritability,ABC-C Irritability,Significantly greater reduction in irritability scores in memantine tx group than placebo.,"Lethargy/social withdrawal, stereotypy, and hyperactivity/noncompliance",ABC-C: all other subscales. ,Significantly greater reduction in scores for hyperactivity and stereotypic bx.,Well tolerated. No differences in extrapyramidal symptom type or frequency between the two tx groups. ,,None,,https://academic.oup.com/ijnp/article/16/4/783/790133,,Medications were dispensed by the investigational drug pharmacist. ,,,,,
Memantine,,,"Valluripalli Soorya, Latha",10.1089/cap.2021.0010,,,Journal of Child and Adolescent Psychopharmacology,RCT - pilot,24 weeks,23,,6-12 y,,Neurocognitive effects,measures of apraxia and expressive language,No improvements in apraxia or expressive language.,"Neurocognitive measures (memory, adaptive behavior, overall cognitive functioning)",Narrative Memory-Recognition; ABC,Memantine treatment associated with improvement in verbal recognition memory and verbal IQ.,,,n=9,,,,,,,,,
Memantine ER,Yes (peppermint),,"Aman, Michael",,"Forest/Allergan, Shire, Bristol-Myers Squibb, BioMarin pharmaceuticals. ",2015,Journal of Child and Adolescent Psychopharmacology,Randomized Double-blind Placebo Controlled  ,12 weeks ,121,101 M: 20 F,6-12 years; Mean: 9 years,3-15 mg/d (based on body weight),Social behaviors. ,SRS total raw score,No significant differences between memantine and placebo tx groups.,,CATS-I total score and subscales; CCC-2; ,No significant differences in CATS-I or CCC-2 scores. ,"All treatment emergent AEs were mild to moderate severity, except for 3 in the memantine tx group (irritability, affective disorder, and choking).",One serious AE (mood/affective disorder) in memantine group unrelated to tx. ,n=17 (3 due to AE in memantine group),99 White; 11 Asian; 4 Black; 7 Other,,,,,,,,
Metformin hydrochloride (Riomet),Yes,,"Anagnastou, E",10.1001/jamapsychiatry.2016.1232,,August 2016,JAMA Psychiatry,Randomized Double-blind Placebo Controlled  ,16 weeks,60,45 M: 15 F,6-17 y; M= 12.8 y (SD: 2.7),500 mg BID for 6-9 y (M: 1000 mg/d); 800 mg BID for 10-17 y (M:1587 mg/d),Treatment of weight gain from atypical antipsychotic use,BMI z score,Metformin was superior to placebo in reducing weight gain. 11% of metformin treatment participants had 8-9% declines in BMI. ,Changes in body composition and metabolic variables,"Body variables: absolute and relative change in weight, absolute BMI, abdominal and hip circumference; fasting metabolic variables ",No significant changes in metabolic variables for metformin or placebo groups. ,"Abnormal feces, increase in GI AEs. ",No serious AEs related to the study drug,n=7 (5 metformin),4 Asian; 4 black or African; 50 white; 2 other/multiracial,"51 participants were obese, 8 overweight, 1 normal weight. Most participants were taking aripiprazole (23) or risperidone (31). https://jamanetwork.com/journals/jamapsychiatry/article-abstract/2546510",Low risk - Randomization conducted using permuted blocks stratified by age group and random block sizes.,"Low risk - Metformin and placebo dispensed as liquid that matched in appearance, smell, and taste",Low risk - All treatment was double blinded. ,Low risk - All treatment was double blinded,Low risk - All baseline and endpoint data reported. ,Low risk - All baseline and endpoint data reported. ,autogenerated randomization ID email sent to site once pt enrolled
Methylphenidate,"Yes (grape, banana)","Chewable tablets (cherry, grape)","Aman, Michael; RUPP",,,"March 29, 2005",Arch Gen Psychiatry,RPCT - Crossover,"13 weeks. 1-wk test-dose phase, 4-wk randomized, placebo-controlled, double blind crossover phase, and 8-wk open-label continuation.",66,59 M: 7 F,5-14 y ,Weight-dependent dosing -  Low dose: 2.5-5.0 mg TID; Mediium dose: 2.5-10.0 mg TID; high dose: 5.0-20.0 TID. See note for more info on dosage.,Hyperactivity,Teacher-rated hyperactivity subscale of ABC,Methylphenidate was superior to placebo on improvements in the primary outcome measure with small to medium effect sizes (0.20-0.54),"Hyperactivity, stereotypy, inappropriate speech, lethargy/social withdrawal.","Parent-rated ABC hyperactivity subscale, and other ABC subscales; rate of 'responders' (classified by much/very improved on CGI-I and 30% decrease in ABC hyperactivity scores)",Significant main effect on parent-rated ABC hyperactivity scale scores (F=6.10; P<.001). Parent-rated lethargy/social withdrawal subscale scores were significantly worse than placebo. Improvements in stereotypy and inappropriate speech at medium dosage. 49% of subjects were responders.,"Common side effects included decreased appetite, difficulty falling asleep, irritability, and outbursts. Intolerable AEs did lead to 7 dropouts.",,"n=7 (3 high dose, 3 medium dose, 1 low dose)",48 white; 9 black/African American; 6 Asian; 3 Hispanic or Latino,"Methylphenidate dosing based on weight. The mean weight of pts was 30.4 kg (SD: 14.3 kg). Doses were administered 3 times per day (8 am, 12 pm, 4 pm). Low dose - 0.125 mg/kg, medium dose - 0.250 mg/kd, high dose - 0.500 mg/kg, per dose. ""Methylphenidate was consistently more efficacious in improving inattention, distractability, hyperactivity, and impulsivity than placebo was, as rated by the ABC hyperactivity scale... small to medium magnitude of response.""","High/unclear risk -  Centrally generated randomization that was balanced by site. There were 2 exceptions to the complete randomized design. ""subjects who could not tolerate the high dosage of methylphenidate received the medium dose twice... and the high dose could not follow the placebo...""",Unclear risk- Method of allocation not reported.,"Unclear risk- Medication form, taste, and color not reported. Methylphenidate and placebo capsules were compounded by an FDA approved pharmacy at the University of Iowa, and shipped to an investigational pharmacist at each site. ","Low risk - Clinicians, patients, and caregiver were blinded to treatment assignment. Prescribing and rating clinician were kept blind to possible treatment related AEs.",Unclear risk - CGI-I scores not reported.,"Unclear risk - All parent-rated and teacher-rated ABC scores and effect sizes were noted. Including, the worsening of lethargy/social withdrawal. No CGI-I scores.","49% of methylphenidate tx participants were rated as responders, though the CGI-I scores and other ABC subscale scores were not reported. The only quantitative data to support the respondent claim would be the ABC hyperactivity scores."
Methylphenidate,"Yes (grape, banana)","Chewable tablets (cherry, grape)","Handen, BL",PUBMED: 11055460,No conflicts of interest,2000,Journal of Autism & Developmental Disorders,"double-blind, randomized, placebo-controlled, cross-over",3 weeks,13,10 M: 3 F,5.6-11.2 y (m: 7.4 y),0.3 mg/kg and 0.6 mg/kg 2-3x per day,Hyperactivity,Conners' Teacher Rating Scale (CTRS); IOWA Conners' Teacher Rating Scale ,,Severity,CARS; ABC,,,,n=1,7 African American; 4 white; 2 Latino,,Unclear risk - method of sequence generation not described,unclear risk - method of concealment not reported,low risk - All outcome assessors blinded,"unclear risk - All parents and participants were blinded. However, it was not reported if participants had taken methylphenidate before.",Unclear risk - Assessment measures data not reported. ,"High risk - Parent rated questionnaires were not reported, only teacher rated assessments.",
Methylphenidate,"Yes (grape, banana)","Chewable tablets (cherry, grape)","Pearson, DA",https://doi.org/10.1089/cap.2012.0096,The authors report having received financial support from pharmaceutical companies (including manufacturers of pharmaceuticals for behavioral syndromes),2013,Journal of Child and Adolescent Psychopharmacology,"double-blind, placebo-controlled, cross-over",4 weeks,24,19 M: 5 F,"7.1-12.7 y (m: 8.8 y, SD: 1.7)",,ADHD symptoms,Conners' Teacher Rating Scale - Revised - Short Form (CTRS-R-SF),Methylphenidate decreased hyperactive and impulsive behavior at school and at home. ,ADHD symptoms,"Swanson, Nolan, and Pelham Questionnaire (SNAP-IV-Teacher); ADD-H Comprehensive Teacher Rating Scale (ACTeRS); Conner's Global Index-Teacher and Parent; ABC-Teacher; CGI-Improvement and CGI-severity); Conners' Parent Rating Scale (CPRS-R); Parent SNAP-IV; Parent ABC; Parent VAS","Methylphenidate treatment decreased hyperactive and impulsive behavior at school and home. Treatment also decreased inattentive and oppositional behavior at home, as well as, increased social skills. ","side effects ""similar to those in typically developing children with ADHD""  - well tolerated",Generally safe,n=0,13 white; 5 Hispanic; 4 African-American; 1 Asian; 1 multiple races,,unclear risk - Not randomized.,unclear risk - Unclear how sequences were allocated. ,"Unclear risk - Over half of the patients had taken methylphenidate before, so parent assessors had known effects of this drug. ",unclear risk - Clinicians and participants were blinded to dosages during trial. It is not stated if parents were blinded. The study physician and psychologist were unblinded during test-dose period. ,low risk - Outcomes reported for all participants.,low risk - All negative side effects and outcome data was reported. ,The authors have financial support from pharmaceutical companies that manufacture medication for behavioural syndromes.
Methylphenidate,Yes,"Chewable tablets (cherry, grape)","Quintana, H",PUBMED: 7559293,No conflicts of interest ,1995,Journal of Autism and Developmental Disorders,Double blind - crossover,6 weeks,10,6 M: 4 F,7-11 y (m: 8.5 y SD: 1.3),10-20 mg BID,Not specified,"CARS, ABC, CTQ hyperactivity, CAPQ",Methylphenidate treatment showed modest but statistically significant improvement in hyperactivity.,,AIMS,,No significant side effects,Generally safe,n=0,Not reported,,Unclear risk - Not described,"Unclear risk - Method of concealment not described, but reported as ""randomly assigned""","Low risk - Clinicians, children and parents were blinded","Low risk - Clinicians, children, and parents were blinded",Low risk,High risk - CARS results not reported. ,
Mirtazapine,No,Yes,"McDougle, Christopher J. ",,,Mar-22,Neuropsychopharmacology,RCT,10 week,30,,5-17,7.5-45 mg/d,Anxiety,PARS; CGI-I,Significant within group decrease in anxiety on PARS. No improvement on CGI. ,,,,,,,,,,,,,,,
"Oxytocin, multiple dose",,,"Bernaerts, Sylvie",10.1186/s13229-020-0313-1,No conflicts of interest. ,"January 15, 2020",BioMed Central,"RPCT - Pilot, parallel design ",4 weeks of treatment; 4 week follow up and 1 yr follow up (60 weeks total),40,100% M,Mean: 24.5 years ,24 IU qD ,Social behaviors. ,SRS-A (self and informant),No treatment specific effects on core social behaviors as measured by SRS-A,Reactivity and avoidance. ,"RBS-R, SAAM, IPPA, WHO-QOL","Avoidance was lower in the oxytocin group for T1, T2, and T3. RBS-R scores were lower at T1, T2, and T3. ",Increased visor for the oxt treatment group. Significant decrease in tension and fatigue at T1 for both groups. ,"Minimal, non treatment specific side effects. ",n=1 oxytocin; n=8 for one year follow up ,not reported,"This study assesses the long-term effects of intranasal oxytocin treatment. ""Long-term beneficial effects on repetitive behaviors and feelings of avoidance are promising and suggestive of a therapeutic potential of oxytocin treatment for ASD.""",,,,,,,
N-Acetylcysteine (NAC),Yes,Yes,"Dean, Olivia ",,No conflicts of interest reported. ,"June 17, 2016",Australian and New Zealand Journal of Psychiatry,"RPCT, Parallel ",6 months,102,79 M: 19 F,3.1-9.9 y,500 mg/d,Social and repetitive behaviors. ,"Social Responsiveness Scale, Children's Communication Checklist, and the Repetitive Behavior Scale-Revised",No differences in the scores for NAC and placebo groups. ,Social behaviors.," Vineland Adaptive Behavior Scales, Social Communication Questionnaire, and clinician-administered Autism Diagnostic Observation Schedule",No differences in the scores for NAC and placebo groups. ,,No significant difference between the treatment and placebo groups in occurrence and severity of adverse events. ,,,"Can only access the abstract, so some data is unknown. ""This study failed to demonstrate any benefit of adjunctive N-acetylcysteine in treating autistic disorder. While this may reflect a true null result, methodological issues particularly the lower dose utilised in this study may be cofounders.""",,,,,,,
